{
  "benchmark": {
    "maxUtilization": 0.8999,
    "method": "simp-oc",
    "solid": "/x8AGRgAMRgAYRgAwRgAgR8A4R8A/x/A//8AAfgBARgDARgOARgcARg4ARhwP/j///8AAfgBARgDARgGARgcARg4ARhwP/j//x8AGRgAMRgAYRgAwRgAgR8A4R8A/x/A",
    "volume": 0.3502604166666667
  },
  "grid": [
    24,
    8,
    4
  ],
  "hints": [
    "まん中の柱は保護されたブロック。削れないし、応力の判定にも入らない。",
    "先端の荷重を、柱を経由して壁まで流す道すじを考えよう。",
    "一度にたくさん削らず、色の変化を見ながら少しずつ。"
  ],
  "id": "w1-03",
  "keep": "ABgAABgAABgAABgAABgAABgAABgAABgAABgAABgAABgAABgAABgAABgAABgAABgAABgAABgAABgAABgAABgAABgAABgAABgAABgAABgAABgAABgAABgAABgAABgAABgA",
  "loads": [
    {
      "cells": [
        [
          22,
          7,
          0
        ],
        [
          23,
          7,
          0
        ],
        [
          22,
          7,
          1
        ],
        [
          23,
          7,
          1
        ],
        [
          22,
          7,
          2
        ],
        [
          23,
          7,
          2
        ],
        [
          22,
          7,
          3
        ],
        [
          23,
          7,
          3
        ]
      ],
      "force": [
        0.0,
        -12340.0,
        0.0
      ]
    }
  ],
  "material": {
    "E": 70000000000.0,
    "allowable": 120000000.0,
    "density": 2700.0,
    "nu": 0.33
  },
  "solid": "////////////////////////////////////////////////////////////////////////////////////////////////////////////////////////////////",
  "supports": [
    {
      "face": "x-",
      "fix": "xyz"
    }
  ],
  "targets": {
    "star1": 0.6503,
    "star2": 0.5003,
    "star3": 0.4003
  },
  "title": "柱のある片持ちはり",
  "version": 1,
  "voxelSize": 0.01,
  "world": 1
}
