{
  "benchmark": {
    "maxUtilization": 0.9,
    "method": "simp-oc",
    "solid": "B4AB4AQAACAIAAAQEAAAGDAAAAxgAAAGwAJAA8ADwAMPwAPwDGAGMAgwDDAYGBgYMAwwDGAOcAbgB+AHwAPAA/////8c+B84HPgfODgcOBwwDDAMcA5wDuAH4AbAA8AD//////z//z8c/D84OPw/HDAOcAxgBmAG4AfgB8ADwAP//////P//Pxz8Pzg4/D8cMA5wDGAGYAbgB+AHwAPAA/////8c+B84HPgfODgcOBwwDDAMcA5wDuAH4AbAA8ADD8AD8AxgBjAIMAwwGBgYGDAMMAxgDnAG4AfgBsADwAMHgAHgBAAAIAgAABAQAAAYMAAADGAAAAbAAkADwAPAAw==",
    "volume": 0.35009765625
  },
  "grid": [
    32,
    8,
    8
  ],
  "hints": [
    "まん中にも支点がある。左右の荷重を、それぞれ近い支点へ流そう。",
    "まん中の支点の上では、上側が引っぱられて赤くなる(ふつうのはりと逆)。"
  ],
  "id": "w2-08",
  "keep": "AAAAAAAAAAAAAAAAAAAAAAAAAAAAAAAAAAAAAAAAAAAAAAAAAAAAAAAAAAAAAAAAAAAAAAAAAAAAAAAAAAAAAAAAAAAAAAAAAAAAAAAAAAAAAAAAAAAAAAAAAAAAAAAAAAAAAAAAAAAAAAAAAAAAAAAAAAAAAAAAAAAAAAAAAAAAAAAAAAAAAAAAAAAAAAAAAAAAAAAAAAAAAAAAAAAAAAAAAAAAAAAAAAAAAAAAAAAAAAAAAAAAAAAAAAAAAAAAAAAAAAAAAAAAAAAAAAAAAAAAAAAAAAAAAAAAAAAAAAAAAAAAAAAAAAAAAAAAAAAAAAAAAAAAAAAAAAAAAAAAAA==",
  "loads": [
    {
      "cells": [
        [
          7,
          7,
          0
        ],
        [
          8,
          7,
          0
        ],
        [
          7,
          7,
          1
        ],
        [
          8,
          7,
          1
        ],
        [
          7,
          7,
          2
        ],
        [
          8,
          7,
          2
        ],
        [
          7,
          7,
          3
        ],
        [
          8,
          7,
          3
        ],
        [
          7,
          7,
          4
        ],
        [
          8,
          7,
          4
        ],
        [
          7,
          7,
          5
        ],
        [
          8,
          7,
          5
        ],
        [
          7,
          7,
          6
        ],
        [
          8,
          7,
          6
        ],
        [
          7,
          7,
          7
        ],
        [
          8,
          7,
          7
        ]
      ],
      "force": [
        0.0,
        -144200.0,
        0.0
      ]
    },
    {
      "cells": [
        [
          23,
          7,
          0
        ],
        [
          24,
          7,
          0
        ],
        [
          23,
          7,
          1
        ],
        [
          24,
          7,
          1
        ],
        [
          23,
          7,
          2
        ],
        [
          24,
          7,
          2
        ],
        [
          23,
          7,
          3
        ],
        [
          24,
          7,
          3
        ],
        [
          23,
          7,
          4
        ],
        [
          24,
          7,
          4
        ],
        [
          23,
          7,
          5
        ],
        [
          24,
          7,
          5
        ],
        [
          23,
          7,
          6
        ],
        [
          24,
          7,
          6
        ],
        [
          23,
          7,
          7
        ],
        [
          24,
          7,
          7
        ]
      ],
      "force": [
        0.0,
        -144200.0,
        0.0
      ]
    }
  ],
  "material": {
    "E": 70000000000.0,
    "allowable": 120000000.0,
    "density": 2700.0,
    "nu": 0.33
  },
  "solid": "/////////////////////////////////////////////////////////////////////////////////////////////////////////////////////////////////////////////////////////////////////////////////////////////////////////////////////////////////////////////////////////////////////////////////////////////////////////////////////////////////////////////////////w==",
  "supports": [
    {
      "cells": [
        [
          0,
          0,
          0
        ],
        [
          1,
          0,
          0
        ],
        [
          0,
          0,
          1
        ],
        [
          1,
          0,
          1
        ],
        [
          0,
          0,
          2
        ],
        [
          1,
          0,
          2
        ],
        [
          0,
          0,
          3
        ],
        [
          1,
          0,
          3
        ],
        [
          0,
          0,
          4
        ],
        [
          1,
          0,
          4
        ],
        [
          0,
          0,
          5
        ],
        [
          1,
          0,
          5
        ],
        [
          0,
          0,
          6
        ],
        [
          1,
          0,
          6
        ],
        [
          0,
          0,
          7
        ],
        [
          1,
          0,
          7
        ]
      ],
      "face": "y-",
      "fix": "xyz"
    },
    {
      "cells": [
        [
          15,
          0,
          0
        ],
        [
          16,
          0,
          0
        ],
        [
          15,
          0,
          1
        ],
        [
          16,
          0,
          1
        ],
        [
          15,
          0,
          2
        ],
        [
          16,
          0,
          2
        ],
        [
          15,
          0,
          3
        ],
        [
          16,
          0,
          3
        ],
        [
          15,
          0,
          4
        ],
        [
          16,
          0,
          4
        ],
        [
          15,
          0,
          5
        ],
        [
          16,
          0,
          5
        ],
        [
          15,
          0,
          6
        ],
        [
          16,
          0,
          6
        ],
        [
          15,
          0,
          7
        ],
        [
          16,
          0,
          7
        ]
      ],
      "face": "y-",
      "fix": "y"
    },
    {
      "cells": [
        [
          30,
          0,
          0
        ],
        [
          31,
          0,
          0
        ],
        [
          30,
          0,
          1
        ],
        [
          31,
          0,
          1
        ],
        [
          30,
          0,
          2
        ],
        [
          31,
          0,
          2
        ],
        [
          30,
          0,
          3
        ],
        [
          31,
          0,
          3
        ],
        [
          30,
          0,
          4
        ],
        [
          31,
          0,
          4
        ],
        [
          30,
          0,
          5
        ],
        [
          31,
          0,
          5
        ],
        [
          30,
          0,
          6
        ],
        [
          31,
          0,
          6
        ],
        [
          30,
          0,
          7
        ],
        [
          31,
          0,
          7
        ]
      ],
      "face": "y-",
      "fix": "y"
    }
  ],
  "targets": {
    "star1": 0.6501,
    "star2": 0.5001,
    "star3": 0.4001
  },
  "title": "三つの支点",
  "version": 1,
  "voxelSize": 0.01,
  "world": 2
}
