{
  "benchmark": {
    "maxUtilization": 0.8998,
    "method": "simp-oc",
    "solid": "//////4DwP/gA4APwAPAB4AP4AEAHngAADgcAADgBwAP/D/gBgAAAAAAAAAAAAAAAARgAAAYMAAAMBwAAOAHAAMAAMAAAAAAAAAAAAAAAAAAAAAAAAAAAAAAAAAAwAMAAwAAwAAAAAAAAAAAAAAAAAAAAAAAAAAAAAAAAADAAwADAADAAAAAAAAAAAAAAAAAAAAAAAAAAAAAAAAAAMADAAMAAMAAAAAAAAAAAAAAAAAAAAAAAAAAAAAAAAAAwAMAD/w/4AYAAAAAAAAAAAAAAAAEYAAAGDAAADAcAADgBwD//////gPA/+ADgA/AA8AHAA/gAQAeeAAAOBwAAOAHAA==",
    "volume": 0.14990234375
  },
  "grid": [
    32,
    8,
    8
  ],
  "hints": [
    "左はピン(動かない)、右はローラー(上下だけ支え、横には滑れる)。",
    "上側は押しつぶされ、下側は引っ張られる。どちらも赤くなる場所に注目。"
  ],
  "id": "w2-01",
  "keep": "AAAAAAAAAAAAAAAAAAAAAAAAAAAAAAAAAAAAAAAAAAAAAAAAAAAAAAAAAAAAAAAAAAAAAAAAAAAAAAAAAAAAAAAAAAAAAAAAAAAAAAAAAAAAAAAAAAAAAAAAAAAAAAAAAAAAAAAAAAAAAAAAAAAAAAAAAAAAAAAAAAAAAAAAAAAAAAAAAAAAAAAAAAAAAAAAAAAAAAAAAAAAAAAAAAAAAAAAAAAAAAAAAAAAAAAAAAAAAAAAAAAAAAAAAAAAAAAAAAAAAAAAAAAAAAAAAAAAAAAAAAAAAAAAAAAAAAAAAAAAAAAAAAAAAAAAAAAAAAAAAAAAAAAAAAAAAAAAAAAAAA==",
  "loads": [
    {
      "cells": [
        [
          15,
          7,
          0
        ],
        [
          16,
          7,
          0
        ],
        [
          15,
          7,
          1
        ],
        [
          16,
          7,
          1
        ],
        [
          15,
          7,
          2
        ],
        [
          16,
          7,
          2
        ],
        [
          15,
          7,
          3
        ],
        [
          16,
          7,
          3
        ],
        [
          15,
          7,
          4
        ],
        [
          16,
          7,
          4
        ],
        [
          15,
          7,
          5
        ],
        [
          16,
          7,
          5
        ],
        [
          15,
          7,
          6
        ],
        [
          16,
          7,
          6
        ],
        [
          15,
          7,
          7
        ],
        [
          16,
          7,
          7
        ]
      ],
      "force": [
        0.0,
        -35950.0,
        0.0
      ]
    }
  ],
  "material": {
    "E": 70000000000.0,
    "allowable": 120000000.0,
    "density": 2700.0,
    "nu": 0.33
  },
  "solid": "/////////////////////////////////////////////////////////////////////////////////////////////////////////////////////////////////////////////////////////////////////////////////////////////////////////////////////////////////////////////////////////////////////////////////////////////////////////////////////////////////////////////////////w==",
  "supports": [
    {
      "cells": [
        [
          0,
          0,
          0
        ],
        [
          1,
          0,
          0
        ],
        [
          0,
          0,
          1
        ],
        [
          1,
          0,
          1
        ],
        [
          0,
          0,
          2
        ],
        [
          1,
          0,
          2
        ],
        [
          0,
          0,
          3
        ],
        [
          1,
          0,
          3
        ],
        [
          0,
          0,
          4
        ],
        [
          1,
          0,
          4
        ],
        [
          0,
          0,
          5
        ],
        [
          1,
          0,
          5
        ],
        [
          0,
          0,
          6
        ],
        [
          1,
          0,
          6
        ],
        [
          0,
          0,
          7
        ],
        [
          1,
          0,
          7
        ]
      ],
      "face": "y-",
      "fix": "xyz"
    },
    {
      "cells": [
        [
          30,
          0,
          0
        ],
        [
          31,
          0,
          0
        ],
        [
          30,
          0,
          1
        ],
        [
          31,
          0,
          1
        ],
        [
          30,
          0,
          2
        ],
        [
          31,
          0,
          2
        ],
        [
          30,
          0,
          3
        ],
        [
          31,
          0,
          3
        ],
        [
          30,
          0,
          4
        ],
        [
          31,
          0,
          4
        ],
        [
          30,
          0,
          5
        ],
        [
          31,
          0,
          5
        ],
        [
          30,
          0,
          6
        ],
        [
          31,
          0,
          6
        ],
        [
          30,
          0,
          7
        ],
        [
          31,
          0,
          7
        ]
      ],
      "face": "y-",
      "fix": "y"
    }
  ],
  "targets": {
    "star1": 0.4499,
    "star2": 0.2999,
    "star3": 0.1999
  },
  "title": "両端で支えるはり",
  "version": 1,
  "voxelSize": 0.01,
  "world": 2
}
