{
  "benchmark": {
    "maxUtilization": 0.8996,
    "method": "simp-oc",
    "solid": "DwAAPwAA8QAA4QMAwQcAgQ8AIQ4A/x8ADwAAHwAAIQAAAQAAAQAAAQAAAQAA/xkADwAAHwAAIQAAAQAAAQAAAQAAAQAA/xkADwAAPwAA8QAA4QMAwQcAgQ8AIQ4A/x8A",
    "volume": 0.20052083333333334
  },
  "grid": [
    24,
    8,
    4
  ],
  "hints": [
    "荷重より先の部分は何も支えていない。どんな色になっているか見てみよう。",
    "根元に近いほど曲げが大きく、赤くなりやすい。"
  ],
  "id": "w1-02",
  "keep": "AAAAAAAAAAAAAAAAAAAAAAAAAAAAAAAAAAAAAAAAAAAAAAAAAAAAAAAAAAAAAAAAAAAAAAAAAAAAAAAAAAAAAAAAAAAAAAAAAAAAAAAAAAAAAAAAAAAAAAAAAAAAAAAA",
  "loads": [
    {
      "cells": [
        [
          11,
          7,
          0
        ],
        [
          12,
          7,
          0
        ],
        [
          11,
          7,
          1
        ],
        [
          12,
          7,
          1
        ],
        [
          11,
          7,
          2
        ],
        [
          12,
          7,
          2
        ],
        [
          11,
          7,
          3
        ],
        [
          12,
          7,
          3
        ]
      ],
      "force": [
        0.0,
        -23030.0,
        0.0
      ]
    }
  ],
  "material": {
    "E": 70000000000.0,
    "allowable": 120000000.0,
    "density": 2700.0,
    "nu": 0.33
  },
  "solid": "////////////////////////////////////////////////////////////////////////////////////////////////////////////////////////////////",
  "supports": [
    {
      "face": "x-",
      "fix": "xyz"
    }
  ],
  "targets": {
    "star1": 0.5005,
    "star2": 0.3505,
    "star3": 0.2505
  },
  "title": "途中で押される片持ちはり",
  "version": 1,
  "voxelSize": 0.01,
  "world": 1
}
