{
  "benchmark": {
    "maxUtilization": 0.8998,
    "method": "simp-oc",
    "solid": "/w8A/x8A/X8A8eMA+YcB/w4A3xgA////fwAABwAAAQAAAcAAAYADAQAHAQAO////fwAAAwAAAQAAAcAAAYADAQAHAQAO/////w8A/x8A/X8A8eMA+YcB/w4A3xgA////",
    "volume": 0.3997395833333333
  },
  "grid": [
    24,
    8,
    4
  ],
  "hints": [
    "上の面全体に荷重がのっている。荷重のかかる上の段は削れない。",
    "先のほうは青く、壁に近いほど赤い。荷重が根元に集まってくるから。",
    "先端からの道は細く、根元へ向かうほど太く残そう。"
  ],
  "id": "w1-06",
  "keep": "AAAAAAAAAAAAAAAAAAAAAAAAAAAAAAAAAAAAAAAAAAAAAAAAAAAAAAAAAAAAAAAAAAAAAAAAAAAAAAAAAAAAAAAAAAAAAAAAAAAAAAAAAAAAAAAAAAAAAAAAAAAAAAAA",
  "loads": [
    {
      "cells": [
        [
          1,
          7,
          0
        ],
        [
          2,
          7,
          0
        ],
        [
          3,
          7,
          0
        ],
        [
          4,
          7,
          0
        ],
        [
          5,
          7,
          0
        ],
        [
          6,
          7,
          0
        ],
        [
          7,
          7,
          0
        ],
        [
          8,
          7,
          0
        ],
        [
          9,
          7,
          0
        ],
        [
          10,
          7,
          0
        ],
        [
          11,
          7,
          0
        ],
        [
          12,
          7,
          0
        ],
        [
          13,
          7,
          0
        ],
        [
          14,
          7,
          0
        ],
        [
          15,
          7,
          0
        ],
        [
          16,
          7,
          0
        ],
        [
          17,
          7,
          0
        ],
        [
          18,
          7,
          0
        ],
        [
          19,
          7,
          0
        ],
        [
          20,
          7,
          0
        ],
        [
          21,
          7,
          0
        ],
        [
          22,
          7,
          0
        ],
        [
          23,
          7,
          0
        ],
        [
          1,
          7,
          1
        ],
        [
          2,
          7,
          1
        ],
        [
          3,
          7,
          1
        ],
        [
          4,
          7,
          1
        ],
        [
          5,
          7,
          1
        ],
        [
          6,
          7,
          1
        ],
        [
          7,
          7,
          1
        ],
        [
          8,
          7,
          1
        ],
        [
          9,
          7,
          1
        ],
        [
          10,
          7,
          1
        ],
        [
          11,
          7,
          1
        ],
        [
          12,
          7,
          1
        ],
        [
          13,
          7,
          1
        ],
        [
          14,
          7,
          1
        ],
        [
          15,
          7,
          1
        ],
        [
          16,
          7,
          1
        ],
        [
          17,
          7,
          1
        ],
        [
          18,
          7,
          1
        ],
        [
          19,
          7,
          1
        ],
        [
          20,
          7,
          1
        ],
        [
          21,
          7,
          1
        ],
        [
          22,
          7,
          1
        ],
        [
          23,
          7,
          1
        ],
        [
          1,
          7,
          2
        ],
        [
          2,
          7,
          2
        ],
        [
          3,
          7,
          2
        ],
        [
          4,
          7,
          2
        ],
        [
          5,
          7,
          2
        ],
        [
          6,
          7,
          2
        ],
        [
          7,
          7,
          2
        ],
        [
          8,
          7,
          2
        ],
        [
          9,
          7,
          2
        ],
        [
          10,
          7,
          2
        ],
        [
          11,
          7,
          2
        ],
        [
          12,
          7,
          2
        ],
        [
          13,
          7,
          2
        ],
        [
          14,
          7,
          2
        ],
        [
          15,
          7,
          2
        ],
        [
          16,
          7,
          2
        ],
        [
          17,
          7,
          2
        ],
        [
          18,
          7,
          2
        ],
        [
          19,
          7,
          2
        ],
        [
          20,
          7,
          2
        ],
        [
          21,
          7,
          2
        ],
        [
          22,
          7,
          2
        ],
        [
          23,
          7,
          2
        ],
        [
          1,
          7,
          3
        ],
        [
          2,
          7,
          3
        ],
        [
          3,
          7,
          3
        ],
        [
          4,
          7,
          3
        ],
        [
          5,
          7,
          3
        ],
        [
          6,
          7,
          3
        ],
        [
          7,
          7,
          3
        ],
        [
          8,
          7,
          3
        ],
        [
          9,
          7,
          3
        ],
        [
          10,
          7,
          3
        ],
        [
          11,
          7,
          3
        ],
        [
          12,
          7,
          3
        ],
        [
          13,
          7,
          3
        ],
        [
          14,
          7,
          3
        ],
        [
          15,
          7,
          3
        ],
        [
          16,
          7,
          3
        ],
        [
          17,
          7,
          3
        ],
        [
          18,
          7,
          3
        ],
        [
          19,
          7,
          3
        ],
        [
          20,
          7,
          3
        ],
        [
          21,
          7,
          3
        ],
        [
          22,
          7,
          3
        ],
        [
          23,
          7,
          3
        ]
      ],
      "force": [
        0.0,
        -35670.0,
        0.0
      ]
    }
  ],
  "material": {
    "E": 70000000000.0,
    "allowable": 120000000.0,
    "density": 2700.0,
    "nu": 0.33
  },
  "solid": "////////////////////////////////////////////////////////////////////////////////////////////////////////////////////////////////",
  "supports": [
    {
      "face": "x-",
      "fix": "xyz"
    }
  ],
  "targets": {
    "star1": 0.6997,
    "star2": 0.5497,
    "star3": 0.4497
  },
  "title": "棚受け",
  "version": 1,
  "voxelSize": 0.01,
  "world": 1
}
