{
  "benchmark": {
    "maxUtilization": 0.8999,
    "method": "simp-oc",
    "solid": "//8BGeADMWAGYTAMwRgYAQ8QwQcA/z/A/x8AAQAAAQAAAQAAAQAAAQAwAQBgf+D//x8AAQAAAQAAAQAAAQAAAQAwAQBgf+D///8BGeADMWAGYTAMwRgYAQ8QwQcA/z/A",
    "volume": 0.2994791666666667
  },
  "grid": [
    24,
    8,
    4
  ],
  "hints": [
    "色は応力の大きさ。青いところはほとんど力を受けていないので、削っても安全。",
    "赤に近いほど限界が近い。赤いところを削ると壊れやすくなる。",
    "曲げられたはりは上下のふちがいちばん働き、まん中の芯は青くなりやすい。"
  ],
  "id": "w1-01",
  "keep": "AAAAAAAAAAAAAAAAAAAAAAAAAAAAAAAAAAAAAAAAAAAAAAAAAAAAAAAAAAAAAAAAAAAAAAAAAAAAAAAAAAAAAAAAAAAAAAAAAAAAAAAAAAAAAAAAAAAAAAAAAAAAAAAA",
  "loads": [
    {
      "cells": [
        [
          22,
          7,
          0
        ],
        [
          23,
          7,
          0
        ],
        [
          22,
          7,
          1
        ],
        [
          23,
          7,
          1
        ],
        [
          22,
          7,
          2
        ],
        [
          23,
          7,
          2
        ],
        [
          22,
          7,
          3
        ],
        [
          23,
          7,
          3
        ]
      ],
      "force": [
        0.0,
        -12290.0,
        0.0
      ]
    }
  ],
  "material": {
    "E": 70000000000.0,
    "allowable": 120000000.0,
    "density": 2700.0,
    "nu": 0.33
  },
  "solid": "////////////////////////////////////////////////////////////////////////////////////////////////////////////////////////////////",
  "supports": [
    {
      "face": "x-",
      "fix": "xyz"
    }
  ],
  "targets": {
    "star1": 0.5995,
    "star2": 0.4495,
    "star3": 0.3495
  },
  "title": "はじめての片持ちはり",
  "version": 1,
  "voxelSize": 0.01,
  "world": 1
}
