{
  "benchmark": {
    "maxUtilization": 0.8998,
    "method": "simp-oc",
    "solid": "AAPAAAAAAAAAAAAAAAAAAAAAAAAAAAAAAAAAAAMAAMCAA/ADAAAAAAAAAAAAAAAAAAAAAAIAAEAGAABgAwAAwMD//wPgAAAHcAAADjgAABwcAAA4DgAAcA4AAHD/////wP//A+AAAAdwAAAOOAAAHBwAADgeAAB4DgAAcP/////A//8D4AAAB3AAAA44AAAcHAAAOB4AAHgOAABw/////8D//wPgAAAHcAAADjgAABwcAAA4DgAAcA4AAHD/////gAPwAwAAAAAAAAAAAAAAAAAAAAACAABABgAAYAMAAMAAA8AAAAAAAAAAAAAAAAAAAAAAAAAAAAAAAAAAAwAAwA==",
    "volume": 0.2001953125
  },
  "grid": [
    32,
    8,
    8
  ],
  "hints": [
    "支点は内側の二か所、荷重は両端の張り出しにかかっている。",
    "支点の真上がいちばんつらい。そこでは上側が引っぱられる。",
    "支点のあいだのまん中は、あまり働いていない。"
  ],
  "id": "w2-07",
  "keep": "AAAAAAAAAAAAAAAAAAAAAAAAAAAAAAAAAAAAAAAAAAAAAAAAAAAAAAAAAAAAAAAAAAAAAAAAAAAAAAAAAAAAAAAAAAAAAAAAAAAAAAAAAAAAAAAAAAAAAAAAAAAAAAAAAAAAAAAAAAAAAAAAAAAAAAAAAAAAAAAAAAAAAAAAAAAAAAAAAAAAAAAAAAAAAAAAAAAAAAAAAAAAAAAAAAAAAAAAAAAAAAAAAAAAAAAAAAAAAAAAAAAAAAAAAAAAAAAAAAAAAAAAAAAAAAAAAAAAAAAAAAAAAAAAAAAAAAAAAAAAAAAAAAAAAAAAAAAAAAAAAAAAAAAAAAAAAAAAAAAAAA==",
  "loads": [
    {
      "cells": [
        [
          0,
          7,
          0
        ],
        [
          1,
          7,
          0
        ],
        [
          0,
          7,
          1
        ],
        [
          1,
          7,
          1
        ],
        [
          0,
          7,
          2
        ],
        [
          1,
          7,
          2
        ],
        [
          0,
          7,
          3
        ],
        [
          1,
          7,
          3
        ],
        [
          0,
          7,
          4
        ],
        [
          1,
          7,
          4
        ],
        [
          0,
          7,
          5
        ],
        [
          1,
          7,
          5
        ],
        [
          0,
          7,
          6
        ],
        [
          1,
          7,
          6
        ],
        [
          0,
          7,
          7
        ],
        [
          1,
          7,
          7
        ]
      ],
      "force": [
        0.0,
        -35590.0,
        0.0
      ]
    },
    {
      "cells": [
        [
          30,
          7,
          0
        ],
        [
          31,
          7,
          0
        ],
        [
          30,
          7,
          1
        ],
        [
          31,
          7,
          1
        ],
        [
          30,
          7,
          2
        ],
        [
          31,
          7,
          2
        ],
        [
          30,
          7,
          3
        ],
        [
          31,
          7,
          3
        ],
        [
          30,
          7,
          4
        ],
        [
          31,
          7,
          4
        ],
        [
          30,
          7,
          5
        ],
        [
          31,
          7,
          5
        ],
        [
          30,
          7,
          6
        ],
        [
          31,
          7,
          6
        ],
        [
          30,
          7,
          7
        ],
        [
          31,
          7,
          7
        ]
      ],
      "force": [
        0.0,
        -35590.0,
        0.0
      ]
    }
  ],
  "material": {
    "E": 70000000000.0,
    "allowable": 120000000.0,
    "density": 2700.0,
    "nu": 0.33
  },
  "solid": "/////////////////////////////////////////////////////////////////////////////////////////////////////////////////////////////////////////////////////////////////////////////////////////////////////////////////////////////////////////////////////////////////////////////////////////////////////////////////////////////////////////////////////w==",
  "supports": [
    {
      "cells": [
        [
          8,
          0,
          0
        ],
        [
          9,
          0,
          0
        ],
        [
          8,
          0,
          1
        ],
        [
          9,
          0,
          1
        ],
        [
          8,
          0,
          2
        ],
        [
          9,
          0,
          2
        ],
        [
          8,
          0,
          3
        ],
        [
          9,
          0,
          3
        ],
        [
          8,
          0,
          4
        ],
        [
          9,
          0,
          4
        ],
        [
          8,
          0,
          5
        ],
        [
          9,
          0,
          5
        ],
        [
          8,
          0,
          6
        ],
        [
          9,
          0,
          6
        ],
        [
          8,
          0,
          7
        ],
        [
          9,
          0,
          7
        ]
      ],
      "face": "y-",
      "fix": "xyz"
    },
    {
      "cells": [
        [
          22,
          0,
          0
        ],
        [
          23,
          0,
          0
        ],
        [
          22,
          0,
          1
        ],
        [
          23,
          0,
          1
        ],
        [
          22,
          0,
          2
        ],
        [
          23,
          0,
          2
        ],
        [
          22,
          0,
          3
        ],
        [
          23,
          0,
          3
        ],
        [
          22,
          0,
          4
        ],
        [
          23,
          0,
          4
        ],
        [
          22,
          0,
          5
        ],
        [
          23,
          0,
          5
        ],
        [
          22,
          0,
          6
        ],
        [
          23,
          0,
          6
        ],
        [
          22,
          0,
          7
        ],
        [
          23,
          0,
          7
        ]
      ],
      "face": "y-",
      "fix": "y"
    }
  ],
  "targets": {
    "star1": 0.5002,
    "star2": 0.3502,
    "star3": 0.2502
  },
  "title": "両側に張り出したはり",
  "version": 1,
  "voxelSize": 0.01,
  "world": 2
}
