{
  "grid": [
    32,
    8,
    8
  ],
  "hints": [
    "二つの荷重のあいだは、どこでも同じ大きさで曲げられている。",
    "それぞれの荷重から支点へ、力がまっすぐ流れる道を残そう。"
  ],
  "id": "w2-02",
  "keep": "AAAAAAAAAAAAAAAAAAAAAAAAAAAAAAAAAAAAAAAAAAAAAAAAAAAAAAAAAAAAAAAAAAAAAAAAAAAAAAAAAAAAAAAAAAAAAAAAAAAAAAAAAAAAAAAAAAAAAAAAAAAAAAAAAAAAAAAAAAAAAAAAAAAAAAAAAAAAAAAAAAAAAAAAAAAAAAAAAAAAAAAAAAAAAAAAAAAAAAAAAAAAAAAAAAAAAAAAAAAAAAAAAAAAAAAAAAAAAAAAAAAAAAAAAAAAAAAAAAAAAAAAAAAAAAAAAAAAAAAAAAAAAAAAAAAAAAAAAAAAAAAAAAAAAAAAAAAAAAAAAAAAAAAAAAAAAAAAAAAAAA==",
  "loads": [
    {
      "cells": [
        [
          10,
          7,
          0
        ],
        [
          11,
          7,
          0
        ],
        [
          10,
          7,
          1
        ],
        [
          11,
          7,
          1
        ],
        [
          10,
          7,
          2
        ],
        [
          11,
          7,
          2
        ],
        [
          10,
          7,
          3
        ],
        [
          11,
          7,
          3
        ],
        [
          10,
          7,
          4
        ],
        [
          11,
          7,
          4
        ],
        [
          10,
          7,
          5
        ],
        [
          11,
          7,
          5
        ],
        [
          10,
          7,
          6
        ],
        [
          11,
          7,
          6
        ],
        [
          10,
          7,
          7
        ],
        [
          11,
          7,
          7
        ]
      ],
      "force": [
        0.0,
        -12000.0,
        0.0
      ]
    },
    {
      "cells": [
        [
          20,
          7,
          0
        ],
        [
          21,
          7,
          0
        ],
        [
          20,
          7,
          1
        ],
        [
          21,
          7,
          1
        ],
        [
          20,
          7,
          2
        ],
        [
          21,
          7,
          2
        ],
        [
          20,
          7,
          3
        ],
        [
          21,
          7,
          3
        ],
        [
          20,
          7,
          4
        ],
        [
          21,
          7,
          4
        ],
        [
          20,
          7,
          5
        ],
        [
          21,
          7,
          5
        ],
        [
          20,
          7,
          6
        ],
        [
          21,
          7,
          6
        ],
        [
          20,
          7,
          7
        ],
        [
          21,
          7,
          7
        ]
      ],
      "force": [
        0.0,
        -12000.0,
        0.0
      ]
    }
  ],
  "material": {
    "E": 70000000000.0,
    "allowable": 120000000.0,
    "density": 2700.0,
    "nu": 0.33
  },
  "solid": "/////////////////////////////////////////////////////////////////////////////////////////////////////////////////////////////////////////////////////////////////////////////////////////////////////////////////////////////////////////////////////////////////////////////////////////////////////////////////////////////////////////////////////w==",
  "supports": [
    {
      "cells": [
        [
          0,
          0,
          0
        ],
        [
          1,
          0,
          0
        ],
        [
          0,
          0,
          1
        ],
        [
          1,
          0,
          1
        ],
        [
          0,
          0,
          2
        ],
        [
          1,
          0,
          2
        ],
        [
          0,
          0,
          3
        ],
        [
          1,
          0,
          3
        ],
        [
          0,
          0,
          4
        ],
        [
          1,
          0,
          4
        ],
        [
          0,
          0,
          5
        ],
        [
          1,
          0,
          5
        ],
        [
          0,
          0,
          6
        ],
        [
          1,
          0,
          6
        ],
        [
          0,
          0,
          7
        ],
        [
          1,
          0,
          7
        ]
      ],
      "face": "y-",
      "fix": "xyz"
    },
    {
      "cells": [
        [
          30,
          0,
          0
        ],
        [
          31,
          0,
          0
        ],
        [
          30,
          0,
          1
        ],
        [
          31,
          0,
          1
        ],
        [
          30,
          0,
          2
        ],
        [
          31,
          0,
          2
        ],
        [
          30,
          0,
          3
        ],
        [
          31,
          0,
          3
        ],
        [
          30,
          0,
          4
        ],
        [
          31,
          0,
          4
        ],
        [
          30,
          0,
          5
        ],
        [
          31,
          0,
          5
        ],
        [
          30,
          0,
          6
        ],
        [
          31,
          0,
          6
        ],
        [
          30,
          0,
          7
        ],
        [
          31,
          0,
          7
        ]
      ],
      "face": "y-",
      "fix": "y"
    }
  ],
  "targets": {
    "star1": 0.7,
    "star2": 0.55,
    "star3": 0.45
  },
  "title": "二点で押されるはり",
  "version": 1,
  "voxelSize": 0.01,
  "world": 2
}
